{
  "schemaVersion": "1.1",
  "coordinateSystem": "normalized-canvas",
  "notes": "IIIF pilot collection. Each artwork uses a stable virtual Canvas whose coordinates scale to the displayed image. Regions are pedagogical semantic overlays and can be reused in Web, AR and VR.",
  "artworks": [
    {
      "artworkId": "ld01",
      "canvas": {
        "width": 1000,
        "height": 1453,
        "image": "/assets/artists/leonardo-da-vinci/collection/mana-lisa-davinci.webp",
        "imageFormat": "image/webp"
      },
      "regions": [
        {
          "id": "ld01.face",
          "shape": "rect",
          "xywh": [
            335,
            245,
            330,
            385
          ],
          "labels": {
            "fr": "Visage",
            "en": "Face",
            "ar": "الوجه"
          },
          "descriptions": {
            "fr": "Le visage concentre le sfumato, les contours adoucis et l’ambiguïté du regard qui contribuent à la présence psychologique du portrait.",
            "en": "The face concentrates sfumato, softened edges, and the ambiguity of the gaze that contribute to the portrait’s psychological presence.",
            "ar": "يركز الوجه على تقنية السفوماتو والحواف الناعمة وغموض النظرة، وهي عناصر تعزز الحضور النفسي في البورتريه."
          },
          "conceptIds": [
            "technique.sfumato",
            "technique.soft-edges",
            "concept.gaze",
            "concept.visual-ambiguity",
            "concept.psychological-presence"
          ]
        },
        {
          "id": "ld01.hands",
          "shape": "rect",
          "xywh": [
            245,
            735,
            510,
            305
          ],
          "labels": {
            "fr": "Mains",
            "en": "Hands",
            "ar": "اليدان"
          },
          "descriptions": {
            "fr": "Le modelé progressif des mains met en évidence le volume, les transitions douces et le rôle des glacis dans la continuité des formes.",
            "en": "The gradual modeling of the hands emphasizes volume, soft transitions, and the role of glazing in maintaining continuity of form.",
            "ar": "يبرز التشكيل التدريجي لليدين الحجم والانتقالات الناعمة ودور الطبقات الشفافة في استمرارية الأشكال."
          },
          "conceptIds": [
            "concept.volume",
            "technique.glazing",
            "technique.soft-edges",
            "concept.contour"
          ]
        },
        {
          "id": "ld01.landscape-left",
          "shape": "rect",
          "xywh": [
            35,
            300,
            275,
            560
          ],
          "labels": {
            "fr": "Paysage gauche",
            "en": "Left landscape",
            "ar": "المشهد الأيسر"
          },
          "descriptions": {
            "fr": "Le paysage lointain utilise la perspective atmosphérique pour produire profondeur et continuité entre la figure humaine et la nature.",
            "en": "The distant landscape uses atmospheric perspective to create depth and continuity between the human figure and nature.",
            "ar": "يستخدم المشهد البعيد المنظور الجوي لإنتاج العمق والاستمرارية بين الشخصية البشرية والطبيعة."
          },
          "conceptIds": [
            "technique.atmospheric-perspective",
            "concept.depth",
            "concept.atmosphere",
            "concept.nature-human-continuity"
          ]
        },
        {
          "id": "ld01.landscape-right",
          "shape": "rect",
          "xywh": [
            690,
            300,
            275,
            560
          ],
          "labels": {
            "fr": "Paysage droit",
            "en": "Right landscape",
            "ar": "المشهد الأيمن"
          },
          "descriptions": {
            "fr": "Les niveaux du paysage et leurs horizons légèrement disjoints renforcent la profondeur et une subtile ambiguïté spatiale.",
            "en": "The landscape levels and their slightly disjointed horizons reinforce depth and a subtle spatial ambiguity.",
            "ar": "تعزز مستويات المشهد وآفاقه غير المتطابقة قليلًا الإحساس بالعمق وبغموض مكاني دقيق."
          },
          "conceptIds": [
            "technique.atmospheric-perspective",
            "concept.depth",
            "concept.spatial-ambiguity",
            "concept.atmosphere"
          ]
        }
      ]
    },
    {
      "artworkId": "ve01",
      "canvas": {
        "width": 1000,
        "height": 1141,
        "image": "/assets/artists/johannes-vermeer/artworks/girl-with-a-pearl-earring/images/vermeer-girl-with-a-pearl-earring.jpg",
        "imageFormat": "image/jpeg"
      },
      "regions": [
        {
          "id": "ve01.headscarf",
          "shape": "rect",
          "xywh": [
            145,
            55,
            700,
            405
          ],
          "labels": {
            "fr": "Coiffe et couleurs",
            "en": "Headscarf and color",
            "ar": "غطاء الرأس والألوان"
          },
          "descriptions": {
            "fr": "La coiffe met en valeur les rapports de couleur et le contraste entre les zones éclairées et le fond sombre.",
            "en": "The headscarf emphasizes color relationships and the contrast between illuminated areas and the dark background.",
            "ar": "يبرز غطاء الرأس العلاقات اللونية والتباين بين المناطق المضيئة والخلفية الداكنة."
          },
          "conceptIds": [
            "concept.color",
            "concept.light",
            "concept.optical-perception"
          ]
        },
        {
          "id": "ve01.garment",
          "shape": "rect",
          "xywh": [
            150,
            650,
            710,
            440
          ],
          "labels": {
            "fr": "Vêtement et volume",
            "en": "Garment and volume",
            "ar": "الملابس والحجم"
          },
          "descriptions": {
            "fr": "Le vêtement combine transitions douces, lumière et modelé pour donner du volume à la figure sans rigidifier les contours.",
            "en": "The garment combines soft transitions, light, and modeling to give the figure volume without hardening its contours.",
            "ar": "تجمع الملابس بين الانتقالات الناعمة والضوء والتشكيل لإعطاء الشخصية حجمًا من دون تصلب الحواف."
          },
          "conceptIds": [
            "concept.volume",
            "technique.soft-edges",
            "concept.light",
            "concept.color"
          ]
        },
        {
          "id": "ve01.pearl",
          "shape": "rect",
          "xywh": [
            650,
            475,
            185,
            250
          ],
          "labels": {
            "fr": "Perle",
            "en": "Pearl",
            "ar": "اللؤلؤة"
          },
          "descriptions": {
            "fr": "La perle est rendue par quelques accents lumineux : un exemple frappant de perception optique et d’économie picturale.",
            "en": "The pearl is rendered with only a few highlights, a striking example of optical perception and pictorial economy.",
            "ar": "تُصوَّر اللؤلؤة ببضع لمعات ضوئية فقط، في مثال واضح على الإدراك البصري والاقتصاد في المعالجة."
          },
          "conceptIds": [
            "concept.light",
            "concept.optical-perception",
            "concept.visual-ambiguity"
          ]
        },
        {
          "id": "ve01.face",
          "shape": "rect",
          "xywh": [
            315,
            220,
            430,
            405
          ],
          "labels": {
            "fr": "Visage et regard",
            "en": "Face and gaze",
            "ar": "الوجه والنظرة"
          },
          "descriptions": {
            "fr": "Le visage, tourné vers le spectateur, concentre le regard, l’intimité et l’ambiguïté identitaire propres à la tronie.",
            "en": "The face, turned toward the viewer, concentrates gaze, intimacy, and the identity ambiguity characteristic of the tronie.",
            "ar": "يركز الوجه الملتفت نحو المشاهد على النظرة والحميمية وغموض الهوية المميز لدراسة الشخصية."
          },
          "conceptIds": [
            "concept.gaze",
            "concept.intimacy",
            "concept.psychological-presence",
            "concept.identity",
            "genre.tronie"
          ]
        }
      ]
    },
    {
      "artworkId": "vg01",
      "canvas": {
        "width": 1000,
        "height": 1204,
        "image": "/assets/artists/vincent-van-gogh/collection/autoportrait-vangogh.webp",
        "imageFormat": "image/webp"
      },
      "regions": [
        {
          "id": "vg01.background",
          "shape": "rect",
          "xywh": [
            655,
            125,
            300,
            655
          ],
          "labels": {
            "fr": "Fond rythmé",
            "en": "Rhythmic background",
            "ar": "الخلفية الإيقاعية"
          },
          "descriptions": {
            "fr": "Les touches courbes du fond donnent un rythme continu à la surface et renforcent la sensation de mouvement autour de la figure.",
            "en": "The curving background strokes create a continuous surface rhythm and strengthen the sense of movement around the figure.",
            "ar": "تخلق ضربات الفرشاة المنحنية في الخلفية إيقاعًا مستمرًا على السطح وتعزز الإحساس بالحركة حول الشخصية."
          },
          "conceptIds": [
            "technique.directional-brushwork",
            "concept.surface-rhythm",
            "concept.movement",
            "concept.brushwork"
          ]
        },
        {
          "id": "vg01.jacket",
          "shape": "rect",
          "xywh": [
            175,
            650,
            670,
            505
          ],
          "labels": {
            "fr": "Veste et contrastes chromatiques",
            "en": "Jacket and chromatic contrasts",
            "ar": "السترة والتباينات اللونية"
          },
          "descriptions": {